model_comparison.csv

Model,Precision,Recall,F1 Score,PR-AUC
Random Forest,0.9605263157894737,0.7448979591836735,0.8390804597701149,0.8541999432510914
Isolation Forest,0.04217479674796748,0.8469387755102041,0.0803484995159729,0.21797227754191925

README.md

# fraud-anomaly-detection Using Machine Learning

Result Analysis:
Random Forest achieved substantially better overall performance. 
As It achieved:
    a. 96.05% precision
    b. 74.49% recall
    c. 83.91% F1-score
    d. 0.8542 PR-AUC
Isolation Forest achieved higher recall at 84.69%, meaning it detected a larger proportion of fraudulent transactions.
However, its precision was only 4.22%, indicating that a large number of transactions identified as anomalies were actually legitimate.
The PR-AUC of Random Forest (0.8542) was also considerably higher than the PR-AUC of Isolation Forest (0.2180).